Klausimo ID,Skyrius,Autorius,Klausimas,Teisingas Raktas,Variantai,Vertintojas,Įvertinimas,Komentaras
1Sam17_001,1Sam17,gemini/gemini-2.5-flash,Koks buvo Galijoto iš Gato ūgis?,a,a: Šešios uolektys su sprindžiu.; b: Penkios uolektys su sprindžiu.; c: Septynios uolektys.; d: Trys uolektys su puse.;,groq/llama-3.3-70b-versatile,5.0,"Klausimas yra aiškus ir tiesiogiai susijęs su pateiktu tekstu, o teisingas atsakymas (a) Šešios uolektys su sprindžiu yra pagrįstas tiesiogine citata iš teksto."
1Sam17_002,1Sam17,gemini/gemini-2.5-flash,"Ką Dovydas pasiėmė su savimi, kad kovotų su filistinu Galijotu, atsisakęs Sauliaus šarvų?",c,"a: Sauliaus kalaviją ir skydą.; b: Lanką ir strėles.; c: Penkis gludžius akmenis, piemens lazdą ir svaidyklę.; d: Tik savo plikomis rankomis.;",groq/llama-3.3-70b-versatile,5.0,"Klausimas yra aiškus ir tikslingas, o teisingas atsakymas (C) yra pagrįstas tiesiogine informacija iš pateiktos Biblijos ištraukos, kuri nusako, kad Dovydas pasiėmė penkis gludžius akmenis, piemens lazdą ir svaidyklę, kad kovotų su filistinu Galijotu."
1Sam17_003,1Sam17,gemini/gemini-2.5-flash,"Kokį atlygį karalius pažadėjo tam, kuris užmuštų Galijotą?",a,"a: Padarys jį turtingą, duos savo dukterį žmona ir atleis nuo mokesčių jo tėvo namus.; b: Paskirs jį kariuomenės vadu ir duos didelę žemės valdą.; c: Apdovanos jį šimtu aviganio avių ir duos jam vario šarvus.; d: Padarys jį savo asmeniniu patarėju.;",groq/llama-3.3-70b-versatile,,
1Sam17_004,1Sam17,groq/llama-3.3-70b-versatile,Kas buvo Galijoto aukštis?,b,a: Penkių uolekčių su sprindžiu; b: Šešių uolekčių su sprindžiu; c: Septynių uolekčių su sprindžiu; d: Aštuonių uolekčių su sprindžiu;,gemini/gemini-2.5-flash,5.0,"Klausimas aiškus, o nurodytas atsakymas (b) yra idealiai teisingas ir tiesiogiai atitinka tekste pateiktą informaciją 1 Samuelio 17, 4 eilutėje, kur nurodoma, kad Galijotas buvo „šešių uolekčių su sprindžiu aukščio vyras“."
1Sam17_005,1Sam17,groq/llama-3.3-70b-versatile,Kas buvo Dovydo tėvas?,b,a: Saulius; b: Jesė; c: Abneras; d: Galijotas;,gemini/gemini-2.5-flash,5.0,"Klausimas yra aiškus ir tiesiogiai atsakomas pagal pateiktą tekstą. Tekste aiškiai nurodoma, kad Dovydas yra Jesės sūnus (1 Sam 17:12, 1 Sam 17:58), todėl nurodytas atsakymas (b) yra idealiai teisingas."
1Sam17_006,1Sam17,groq/llama-3.3-70b-versatile,"Ką Dovydas naudojo, kad nukautų Galijotą?",a,a: Svaidyklę ir akmenį; b: Kalaviją; c: Ietį; d: Lanką ir strėles;,gemini/gemini-2.5-flash,5.0,"Tekste aiškiai nurodoma, kad Dovydas filistiną užmušė svaidykle ir akmeniu (1 Sam 17, 50). Atsakymas A yra visiškai teisingas ir tiksliai atspindi teksto informaciją."
